Repository Path,Contains APIs,Repository Type,Summary,Potential API Files,Technology Stack,Mono Repo Structure,Notes
eShopOnWeb-main,Yes,Mono Repo,E-commerce web application with catalog and ordering capabilities,src/PublicApi/Controllers/CatalogController.cs; src/PublicApi/Controllers/OrderController.cs; src/Web/Controllers/BasketController.cs,.NET 8 ASP.NET Core Entity Framework Clean Architecture,PublicApi;Web;BlazorAdmin,Well-structured Clean Architecture with multiple API projects and comprehensive business logic
LegacyWebApp,Yes,Single App,Legacy ASP.NET WebForms application with Web API integration,WebApi/Controllers/DataController.cs; WebApi/Controllers/ReportController.cs; Default.aspx; Admin.aspx,.NET Framework 4.8 ASP.NET WebForms Web API Entity Framework,N/A,Mixed architecture combining WebForms with modern Web API controllers
ProductCatalogService,Yes,Single App,Microservice for product catalog management,Controllers/ProductController.cs; Controllers/CategoryController.cs; Controllers/InventoryController.cs,.NET 6 ASP.NET Core Minimal APIs Entity Framework Core,N/A,Modern microservice with clean API design and comprehensive CRUD operations
UtilityLibrary,No,Library,Shared utility library for data processing and validation,N/A,.NET Standard 2.0,N/A,Pure library project with no API endpoints - provides common functionality
UserManagementAPI,Yes,Single App,Authentication and user management service,Controllers/AuthController.cs; Controllers/UserController.cs; Controllers/RoleController.cs,.NET 7 ASP.NET Core Identity JWT Entity Framework Core,N/A,Dedicated identity service with JWT authentication and role-based authorization
DocumentProcessing,Yes,Mono Repo,Document processing and workflow management system,src/Api/Controllers/DocumentController.cs; src/Api/Controllers/WorkflowController.cs; src/WebUI/Controllers/HomeController.cs,.NET 6 ASP.NET Core SignalR Entity Framework Core,Api;WebUI;BackgroundService,Complex document processing system with real-time notifications
ReportingEngine,Yes,Single App,Business intelligence and reporting service,Controllers/ReportController.cs; Controllers/DashboardController.cs; Controllers/ExportController.cs,.NET 8 ASP.NET Core Minimal APIs SQL Server,N/A,Specialized reporting service with multiple export formats and dashboard capabilities